topic,source_a_id,source_b_id,conflict_summary,possible_explanations,what_would_resolve_it,status
product category,S3,S17,"Agent 365 suggests a control-plane framing centered on observability and governance, while Magentic-UI suggests a human-centered mixed-initiative interaction framing.","These are solving different levels of the stack: fleet oversight versus task-level human collaboration.","Decide explicitly whether humanctl owns fleet supervision or human unblock loops.",interpreted
ui openness,S1,S19,"AG-UI allows open-ended generative UI and shared state, while Copilot Workspace emphasizes staged editable flow.","Open-ended protocol primitives do not require an unstructured product UX; humanctl can use structured surfaces on top of flexible payloads.","Choose whether v1 is optimized for general layout freedom or for staged asks/artifacts/watches.",interpreted
interruption strategy,S11,S17,"Interruption research warns about stress costs, while Magentic-UI still includes proactive user interruptions for clarifications and approvals.","The tension is resolved if interruptions are rare, high-value, and easy to dismiss or defer.","Define explicit escalation levels and thresholds for when live interruption is acceptable.",interpreted
source of truth,S12,S3,"Local-first principles put the primary copy on the local device, while control-plane products are cloud-centric and centralized.","These approaches optimize for different trust and deployment models.","Decide whether humanctl is fundamentally local infrastructure or a hosted coordination service.",resolved
object model,S15,S16,"Magentic-UI emphasizes plans, approvals, and tasks, while the current humanctl concept has a very generic `thing` abstraction.","A generic internal abstraction may still coexist with more semantic user-facing objects.","Decide whether `thing` remains internal while `ask`, `artifact`, and `watch` become product-facing terms.",open
